{
  "schema_version": "1.0",
  "config_version": "1.0.0",
  "updated_at": "2026-07-18T00:00:00Z",
  "updated_by": "admin",
  "items": [],
  "release": {
    "version": "1.0.0",
    "release_date": "2026-07-18",
    "description": "初始规则配置版本"
  },
  "compatibility": {
    "minimum_worker_version": "1.0.0",
    "minimum_bot_version": "1.0.0",
    "minimum_database_schema_version": "1.0.0"
  },
  "files": {
    "category": "1.0.0",
    "tag_dictionary": "1.0.0",
    "actor_dictionary": "1.0.0",
    "alias": "1.0.0",
    "ignored": "1.0.0",
    "display": "1.0.0",
    "search": "1.0.0",
    "review_rules": "1.0.0"
  }
}
